{
  "schema": "dayz.command.v1",
  "command_id": "cmd_dlv_fixture_restart_game_v1",
  "server_id": "livonia-1",
  "created_at": "2030-01-01T12:01:00Z",
  "expires_at": "2030-01-01T12:06:00Z",
  "channel": "global",
  "message": "Сервер будет перезапущен через 5 минут. Найдите безопасное место.",
  "metadata": {
    "event_id": "evt_9550b478391c25085ecfa1293a840d3c",
    "policy_version": "dayz-policy-v1"
  }
}
